week,site,content_type,target_keyword,url,action
1,"K1 Fix Center","fix","k1 game app crash","/guides/app-crash-fix/","Publish or improve: K1 Game App Crash Fix"
1,"K1 Fix Center","fix","k1 game not opening","/guides/not-opening/","Publish or improve: K1 Game Not Opening: Fix Path"
1,"K1 Fix Center","fix","k1 game login error","/guides/login-error-fix/","Publish or improve: K1 Game Login Error Fix"
2,"K1 Fix Center","fix","k1 game otp problem","/guides/otp-problem-solution/","Publish or improve: K1 Game OTP Problem Solution"
2,"K1 Fix Center","fix","k1 game network error","/guides/network-error/","Publish or improve: K1 Game Network Error Fix"
2,"K1 Fix Center","tutorial","clear cache k1 game","/guides/cache-clear-guide/","Publish or improve: Clear Cache for K1 Game App"
3,"K1 Fix Center","fix","k1 game crashes after update","/guides/update-after-crash/","Publish or improve: K1 Game Crashes After Update"
3,"K1 Fix Center","tutorial","k1 game reinstall","/guides/reinstall-guide/","Publish or improve: K1 Game Reinstall Guide"
3,"K1 Fix Center","support","k1 game support evidence","/guides/support-evidence/","Publish or improve: K1 Game Support Evidence Checklist"
4,"K1 Fix Center","device","k1 game storage problem","/guides/device-storage/","Publish or improve: K1 Game Device Storage Problems"
4,"K1 Fix Center","faq","k1 game fix faq","/guides/fix-faq/","Publish or improve: K1 Game Fix Center FAQ"
4,"K1 Fix Center","freshness","k1 game error log","/guides/weekly-error-log/","Publish or improve: Weekly K1 Game Error Log"
5,"K1 Fix Center","refresh","k1 game not working","/","Review GSC impressions, rewrite title, add FAQ, update internal links"
6,"K1 Fix Center","refresh","k1 game not working","/","Review GSC impressions, rewrite title, add FAQ, update internal links"
7,"K1 Fix Center","refresh","k1 game not working","/","Review GSC impressions, rewrite title, add FAQ, update internal links"
8,"K1 Fix Center","refresh","k1 game not working","/","Review GSC impressions, rewrite title, add FAQ, update internal links"
9,"K1 Fix Center","fix","k1 game black screen","/guides/black-screen-fix/","Publish or improve: K1 Game Black Screen Fix on Android"
"2026-06-13","published","k1 game network error mobile data","/guides/network-error-mobile-data/","second content expansion","new long-tail page with FAQ, internal links, GA and sitemap entry"
"2026-06-13","published","k1 game verification error fix","/guides/verification-error-fix/","third content expansion","new long-tail page with K1 public evidence, FAQ, schema and internal links"
